title,description,url,image
Todo App,AI assited tasking to improve daily efficiency. Have more free time with my todo web app. ,www.google.com,Todo.jpg
Porfolio Website,Web Design concepts come to life in a briliently designed website.,www.google.com,portfolio.jpg
PDF Templates,Making PDFs faster and easier than all other applications on the internet. ,www.google.com,pdf_maker.jpg
PDF Invoices,Nearly instant invoices for high-speed billing. ,www.google.com,pdf_1.jpg
Positive News Site,Lifting reaaders up sinice 2025. We deliver the best news!,www.google.com,news.jpg
AI Flashcards,Study faster with an AI assistant to keep your mind sharp. ,www.google.com,flashcards.jpg